{
  "problem_id": "maa-amc10-2022-a-q10",
  "competition": "AMC 10A",
  "year": 2022,
  "domain": "geometry",
  "status": "verified",
  "method": "lean",
  "formal_statement": null,
  "proof_source": "tools/math-verifier/fixtures/AmcPilotBatch4.lean",
  "source_sha256": "2c02139d514d6ccc368b174ea666f789e735891ca7a7d350a27d6db3c99d3e7b",
  "verifier_revision": "ea6e7d745af5b5a7e008bb0bb4460818174dde7d",
  "lean_toolchain": "leanprover/lean4:v4.34.1",
  "mathlib_revision": "d13f23b723b8a846827a245b89c10fc7d3f11612",
  "duration_ms": 3158,
  "attempts": 1,
  "error": null,
  "verified_at": "2026-10-02T14:26:29.289130Z"
}
