{
  "problem_id": "maa-amc10-2022-a-sample-q03",
  "competition": "AMC 10A",
  "year": 2022,
  "domain": "algebra",
  "status": "verified",
  "method": "lean",
  "formal_statement": null,
  "proof_source": "tools/math-verifier/fixtures/Amc10Pilot.lean",
  "source_sha256": "9eedcf9fdd0c8c215e59c899f93801acf03ef7735c08b0ab3ff50360c98e2d94",
  "verifier_revision": "ca8bc669a17130c10ecbaa8f64989e99ec50d733",
  "lean_toolchain": "leanprover/lean4:v4.34.1",
  "mathlib_revision": "d13f23b723b8a846827a245b89c10fc7d3f11612",
  "duration_ms": 2929,
  "attempts": 1,
  "error": null,
  "verified_at": "2026-10-02T14:33:04.450963Z"
}
